{
  "schema_version": "0.1.0",
  "revision": "1",
  "scene_id": "scene:workshop",
  "theme_id": "theme:native",
  "widgets": [
    {
      "id": "widget:network",
      "kind": "table",
      "title": "Network connections",
      "display_id": "display:primary",
      "layout": {
        "x": 24,
        "y": 24,
        "width": 640,
        "height": 240
      },
      "bindings": [
        {
          "entity_id": "host:demo/nic:1",
          "field": "network.media"
        }
      ],
      "priority": "essential"
    }
  ]
}
